{
  "season": 2026,
  "week": 2,
  "updated_utc": "2026-09-20T21:43:31Z",
  "games": [
    {
      "game_id": "401872935",
      "home": "TB",
      "away": "CLE",
      "kickoff_utc": "2026-09-20T17:00Z",
      "roof": "outdoor",
      "probs": {
        "home": 0.5926,
        "away": 0.4074
      },
      "model": "elo_prior",
      "estimate": true
    },
    {
      "game_id": "401872940",
      "home": "DEN",
      "away": "JAX",
      "kickoff_utc": "2026-09-20T20:05Z",
      "roof": "outdoor",
      "probs": {
        "home": 0.4823,
        "away": 0.5177
      },
      "model": "elo_prior",
      "estimate": true
    },
    {
      "game_id": "401872941",
      "home": "LAC",
      "away": "LV",
      "kickoff_utc": "2026-09-20T20:05Z",
      "roof": "outdoor",
      "probs": {
        "home": 0.6507,
        "away": 0.3493
      },
      "model": "elo_prior",
      "estimate": true
    },
    {
      "game_id": "401872944",
      "home": "DAL",
      "away": "WAS",
      "kickoff_utc": "2026-09-20T20:25Z",
      "roof": "indoor",
      "probs": {
        "home": 0.5669,
        "away": 0.4331
      },
      "model": "elo_prior",
      "estimate": true
    },
    {
      "game_id": "401872943",
      "home": "ARI",
      "away": "SEA",
      "kickoff_utc": "2026-09-20T20:25Z",
      "roof": "indoor",
      "probs": {
        "home": 0.4354,
        "away": 0.5646
      },
      "model": "elo_prior",
      "estimate": true
    },
    {
      "game_id": "401872942",
      "home": "SF",
      "away": "MIA",
      "kickoff_utc": "2026-09-20T20:25Z",
      "roof": "outdoor",
      "probs": {
        "home": 0.7652,
        "away": 0.2348
      },
      "model": "elo_prior",
      "estimate": true
    },
    {
      "game_id": "401872933",
      "home": "ATL",
      "away": "CAR",
      "kickoff_utc": "2026-09-20T17:00Z",
      "roof": "indoor",
      "probs": {
        "home": 0.3832,
        "away": 0.6168
      },
      "model": "elo_prior",
      "estimate": true
    },
    {
      "game_id": "401872937",
      "home": "CHI",
      "away": "MIN",
      "kickoff_utc": "2026-09-20T17:00Z",
      "roof": "outdoor",
      "probs": {
        "home": 0.6201,
        "away": 0.3799
      },
      "model": "elo_prior",
      "estimate": true
    },
    {
      "game_id": "401872939",
      "home": "TEN",
      "away": "PHI",
      "kickoff_utc": "2026-09-20T17:00Z",
      "roof": "outdoor",
      "probs": {
        "home": 0.3318,
        "away": 0.6682
      },
      "model": "elo_prior",
      "estimate": true
    },
    {
      "game_id": "401872946",
      "home": "NE",
      "away": "PIT",
      "kickoff_utc": "2026-09-20T17:00Z",
      "roof": "outdoor",
      "probs": {
        "home": 0.6762,
        "away": 0.3238
      },
      "model": "elo_prior",
      "estimate": true
    },
    {
      "game_id": "401872936",
      "home": "NYJ",
      "away": "GB",
      "kickoff_utc": "2026-09-20T17:00Z",
      "roof": "outdoor",
      "probs": {
        "home": 0.4512,
        "away": 0.5488
      },
      "model": "elo_prior",
      "estimate": true
    },
    {
      "game_id": "401872938",
      "home": "BAL",
      "away": "NO",
      "kickoff_utc": "2026-09-20T17:00Z",
      "roof": "outdoor",
      "probs": {
        "home": 0.5873,
        "away": 0.4127
      },
      "model": "elo_prior",
      "estimate": true
    },
    {
      "game_id": "401872934",
      "home": "HOU",
      "away": "CIN",
      "kickoff_utc": "2026-09-20T17:00Z",
      "roof": "indoor",
      "probs": {
        "home": 0.5579,
        "away": 0.4421
      },
      "model": "elo_prior",
      "estimate": true
    },
    {
      "game_id": "401872945",
      "home": "KC",
      "away": "IND",
      "kickoff_utc": "2026-09-21T00:20Z",
      "roof": "outdoor",
      "probs": {
        "home": 0.633,
        "away": 0.367
      },
      "model": "elo_prior",
      "estimate": true
    },
    {
      "game_id": "401872932",
      "home": "BUF",
      "away": "DET",
      "kickoff_utc": "2026-09-18T00:15Z",
      "roof": "outdoor",
      "probs": {
        "home": 0.6929,
        "away": 0.3071
      },
      "model": "elo_prior",
      "estimate": true
    },
    {
      "game_id": "401872947",
      "home": "LAR",
      "away": "NYG",
      "kickoff_utc": "2026-09-22T00:15Z",
      "roof": "outdoor",
      "probs": {
        "home": 0.6593,
        "away": 0.3407
      },
      "model": "elo_prior",
      "estimate": true
    }
  ]
}
