{
  "season": 2026,
  "week": 5,
  "updated_utc": "2026-10-08T23:22:25Z",
  "games": [
    {
      "game_id": "401872980",
      "home": "DAL",
      "away": "TB",
      "kickoff_utc": "2026-10-09T00:15Z",
      "roof": "indoor",
      "probs": {
        "home": 0.7483,
        "away": 0.2517
      },
      "model": "elo_prior",
      "estimate": true
    },
    {
      "game_id": "401872981",
      "home": "JAX",
      "away": "PHI",
      "kickoff_utc": "2026-10-11T13:30Z",
      "roof": "outdoor",
      "probs": {
        "home": 0.7297,
        "away": 0.2703
      },
      "model": "elo_prior",
      "estimate": true
    },
    {
      "game_id": "401872990",
      "home": "GB",
      "away": "CHI",
      "kickoff_utc": "2026-10-11T17:00Z",
      "roof": "outdoor",
      "probs": {
        "home": 0.5244,
        "away": 0.4756
      },
      "model": "elo_prior",
      "estimate": true
    },
    {
      "game_id": "401872984",
      "home": "TEN",
      "away": "HOU",
      "kickoff_utc": "2026-10-11T17:00Z",
      "roof": "outdoor",
      "probs": {
        "home": 0.3724,
        "away": 0.6276
      },
      "model": "elo_prior",
      "estimate": true
    },
    {
      "game_id": "401872982",
      "home": "MIA",
      "away": "CIN",
      "kickoff_utc": "2026-10-11T17:00Z",
      "roof": "outdoor",
      "probs": {
        "home": 0.4143,
        "away": 0.5857
      },
      "model": "elo_prior",
      "estimate": true
    },
    {
      "game_id": "401872986",
      "home": "NE",
      "away": "LV",
      "kickoff_utc": "2026-10-11T17:00Z",
      "roof": "outdoor",
      "probs": {
        "home": 0.7034,
        "away": 0.2966
      },
      "model": "elo_prior",
      "estimate": true
    },
    {
      "game_id": "401872987",
      "home": "NO",
      "away": "MIN",
      "kickoff_utc": "2026-10-11T17:00Z",
      "roof": "indoor",
      "probs": {
        "home": 0.3425,
        "away": 0.6575
      },
      "model": "elo_prior",
      "estimate": true
    },
    {
      "game_id": "401872983",
      "home": "NYJ",
      "away": "CLE",
      "kickoff_utc": "2026-10-11T17:00Z",
      "roof": "outdoor",
      "probs": {
        "home": 0.4356,
        "away": 0.5644
      },
      "model": "elo_prior",
      "estimate": true
    },
    {
      "game_id": "401872985",
      "home": "PIT",
      "away": "IND",
      "kickoff_utc": "2026-10-11T17:00Z",
      "roof": "outdoor",
      "probs": {
        "home": 0.5897,
        "away": 0.4103
      },
      "model": "elo_prior",
      "estimate": true
    },
    {
      "game_id": "401872988",
      "home": "WAS",
      "away": "NYG",
      "kickoff_utc": "2026-10-11T17:00Z",
      "roof": "outdoor",
      "probs": {
        "home": 0.4556,
        "away": 0.5444
      },
      "model": "elo_prior",
      "estimate": true
    },
    {
      "game_id": "401872989",
      "home": "LAC",
      "away": "DEN",
      "kickoff_utc": "2026-10-11T20:05Z",
      "roof": "outdoor",
      "probs": {
        "home": 0.3884,
        "away": 0.6116
      },
      "model": "elo_prior",
      "estimate": true
    },
    {
      "game_id": "401872991",
      "home": "ARI",
      "away": "DET",
      "kickoff_utc": "2026-10-11T20:25Z",
      "roof": "indoor",
      "probs": {
        "home": 0.4422,
        "away": 0.5578
      },
      "model": "elo_prior",
      "estimate": true
    },
    {
      "game_id": "401872992",
      "home": "SEA",
      "away": "SF",
      "kickoff_utc": "2026-10-11T20:25Z",
      "roof": "outdoor",
      "probs": {
        "home": 0.5646,
        "away": 0.4354
      },
      "model": "elo_prior",
      "estimate": true
    },
    {
      "game_id": "401872993",
      "home": "ATL",
      "away": "BAL",
      "kickoff_utc": "2026-10-12T00:20Z",
      "roof": "indoor",
      "probs": {
        "home": 0.5287,
        "away": 0.4713
      },
      "model": "elo_prior",
      "estimate": true
    },
    {
      "game_id": "401872994",
      "home": "LAR",
      "away": "BUF",
      "kickoff_utc": "2026-10-13T00:15Z",
      "roof": "outdoor",
      "probs": {
        "home": 0.526,
        "away": 0.474
      },
      "model": "elo_prior",
      "estimate": true
    }
  ]
}
