{
  "season": 2026,
  "week": 1,
  "updated_utc": "2026-08-07T04:24:45Z",
  "games": [
    {
      "game_id": "401872656",
      "home": "SEA",
      "away": "NE",
      "kickoff_utc": "2026-09-10T00:20Z",
      "roof": "outdoor",
      "probs": {
        "home": 0.61,
        "away": 0.39
      },
      "model": "elo_prior",
      "estimate": true
    },
    {
      "game_id": "401872657",
      "home": "LAR",
      "away": "SF",
      "kickoff_utc": "2026-09-11T00:35Z",
      "roof": "outdoor",
      "probs": {
        "home": 0.5927,
        "away": 0.4073
      },
      "model": "elo_prior",
      "estimate": true
    },
    {
      "game_id": "401872925",
      "home": "CIN",
      "away": "TB",
      "kickoff_utc": "2026-09-13T17:00Z",
      "roof": "outdoor",
      "probs": {
        "home": 0.5583,
        "away": 0.4417
      },
      "model": "elo_prior",
      "estimate": true
    },
    {
      "game_id": "401872923",
      "home": "DET",
      "away": "NO",
      "kickoff_utc": "2026-09-13T17:00Z",
      "roof": "indoor",
      "probs": {
        "home": 0.6224,
        "away": 0.3776
      },
      "model": "elo_prior",
      "estimate": true
    },
    {
      "game_id": "401872924",
      "home": "TEN",
      "away": "NYJ",
      "kickoff_utc": "2026-09-13T17:00Z",
      "roof": "outdoor",
      "probs": {
        "home": 0.5829,
        "away": 0.4171
      },
      "model": "elo_prior",
      "estimate": true
    },
    {
      "game_id": "401872659",
      "home": "IND",
      "away": "BAL",
      "kickoff_utc": "2026-09-13T17:00Z",
      "roof": "indoor",
      "probs": {
        "home": 0.5307,
        "away": 0.4693
      },
      "model": "elo_prior",
      "estimate": true
    },
    {
      "game_id": "401872658",
      "home": "PIT",
      "away": "ATL",
      "kickoff_utc": "2026-09-13T17:00Z",
      "roof": "outdoor",
      "probs": {
        "home": 0.5926,
        "away": 0.4074
      },
      "model": "elo_prior",
      "estimate": true
    },
    {
      "game_id": "401872661",
      "home": "CAR",
      "away": "CHI",
      "kickoff_utc": "2026-09-13T17:00Z",
      "roof": "outdoor",
      "probs": {
        "home": 0.4827,
        "away": 0.5173
      },
      "model": "elo_prior",
      "estimate": true
    },
    {
      "game_id": "401872922",
      "home": "JAX",
      "away": "CLE",
      "kickoff_utc": "2026-09-13T17:00Z",
      "roof": "outdoor",
      "probs": {
        "home": 0.7299,
        "away": 0.2701
      },
      "model": "elo_prior",
      "estimate": true
    },
    {
      "game_id": "401872660",
      "home": "HOU",
      "away": "BUF",
      "kickoff_utc": "2026-09-13T17:00Z",
      "roof": "indoor",
      "probs": {
        "home": 0.5896,
        "away": 0.4104
      },
      "model": "elo_prior",
      "estimate": true
    },
    {
      "game_id": "401872928",
      "home": "LV",
      "away": "MIA",
      "kickoff_utc": "2026-09-13T20:25Z",
      "roof": "indoor",
      "probs": {
        "home": 0.4647,
        "away": 0.5353
      },
      "model": "elo_prior",
      "estimate": true
    },
    {
      "game_id": "401872927",
      "home": "MIN",
      "away": "GB",
      "kickoff_utc": "2026-09-13T20:25Z",
      "roof": "indoor",
      "probs": {
        "home": 0.5881,
        "away": 0.4119
      },
      "model": "elo_prior",
      "estimate": true
    },
    {
      "game_id": "401872929",
      "home": "PHI",
      "away": "WAS",
      "kickoff_utc": "2026-09-13T20:25Z",
      "roof": "outdoor",
      "probs": {
        "home": 0.6564,
        "away": 0.3436
      },
      "model": "elo_prior",
      "estimate": true
    },
    {
      "game_id": "401872926",
      "home": "LAC",
      "away": "ARI",
      "kickoff_utc": "2026-09-13T20:25Z",
      "roof": "outdoor",
      "probs": {
        "home": 0.705,
        "away": 0.295
      },
      "model": "elo_prior",
      "estimate": true
    },
    {
      "game_id": "401872930",
      "home": "NYG",
      "away": "DAL",
      "kickoff_utc": "2026-09-14T00:20Z",
      "roof": "outdoor",
      "probs": {
        "home": 0.5452,
        "away": 0.4548
      },
      "model": "elo_prior",
      "estimate": true
    },
    {
      "game_id": "401872931",
      "home": "KC",
      "away": "DEN",
      "kickoff_utc": "2026-09-15T00:15Z",
      "roof": "outdoor",
      "probs": {
        "home": 0.4062,
        "away": 0.5938
      },
      "model": "elo_prior",
      "estimate": true
    }
  ]
}
