{
  "season": 2026,
  "week": 3,
  "updated_utc": "2026-09-28T23:42:37Z",
  "games": [
    {
      "game_id": "401872963",
      "home": "CHI",
      "away": "PHI",
      "kickoff_utc": "2026-09-29T00:15Z",
      "roof": "outdoor",
      "probs": {
        "home": 0.4541,
        "away": 0.5459
      },
      "model": "elo_prior",
      "estimate": true
    },
    {
      "game_id": "401872948",
      "home": "GB",
      "away": "ATL",
      "kickoff_utc": "2026-09-25T00:15Z",
      "roof": "outdoor",
      "probs": {
        "home": 0.5355,
        "away": 0.4645
      },
      "model": "elo_prior",
      "estimate": true
    },
    {
      "game_id": "401872953",
      "home": "BUF",
      "away": "LAC",
      "kickoff_utc": "2026-09-27T17:00Z",
      "roof": "outdoor",
      "probs": {
        "home": 0.7725,
        "away": 0.2275
      },
      "model": "elo_prior",
      "estimate": true
    },
    {
      "game_id": "401872949",
      "home": "CLE",
      "away": "CAR",
      "kickoff_utc": "2026-09-27T17:00Z",
      "roof": "outdoor",
      "probs": {
        "home": 0.5621,
        "away": 0.4379
      },
      "model": "elo_prior",
      "estimate": true
    },
    {
      "game_id": "401872954",
      "home": "DET",
      "away": "NYJ",
      "kickoff_utc": "2026-09-27T17:00Z",
      "roof": "indoor",
      "probs": {
        "home": 0.7099,
        "away": 0.2901
      },
      "model": "elo_prior",
      "estimate": true
    },
    {
      "game_id": "401872951",
      "home": "IND",
      "away": "HOU",
      "kickoff_utc": "2026-09-27T17:00Z",
      "roof": "indoor",
      "probs": {
        "home": 0.4919,
        "away": 0.5081
      },
      "model": "elo_prior",
      "estimate": true
    },
    {
      "game_id": "401872952",
      "home": "MIA",
      "away": "KC",
      "kickoff_utc": "2026-09-27T17:00Z",
      "roof": "outdoor",
      "probs": {
        "home": 0.3684,
        "away": 0.6316
      },
      "model": "elo_prior",
      "estimate": true
    },
    {
      "game_id": "401872956",
      "home": "NYG",
      "away": "TEN",
      "kickoff_utc": "2026-09-27T17:00Z",
      "roof": "outdoor",
      "probs": {
        "home": 0.7011,
        "away": 0.2989
      },
      "model": "elo_prior",
      "estimate": true
    },
    {
      "game_id": "401872950",
      "home": "PIT",
      "away": "CIN",
      "kickoff_utc": "2026-09-27T17:00Z",
      "roof": "outdoor",
      "probs": {
        "home": 0.5766,
        "away": 0.4234
      },
      "model": "elo_prior",
      "estimate": true
    },
    {
      "game_id": "401872955",
      "home": "WAS",
      "away": "SEA",
      "kickoff_utc": "2026-09-27T17:00Z",
      "roof": "outdoor",
      "probs": {
        "home": 0.2204,
        "away": 0.7796
      },
      "model": "elo_prior",
      "estimate": true
    },
    {
      "game_id": "401872957",
      "home": "JAX",
      "away": "NE",
      "kickoff_utc": "2026-09-27T17:00Z",
      "roof": "outdoor",
      "probs": {
        "home": 0.628,
        "away": 0.372
      },
      "model": "elo_prior",
      "estimate": true
    },
    {
      "game_id": "401872958",
      "home": "SF",
      "away": "ARI",
      "kickoff_utc": "2026-09-27T20:05Z",
      "roof": "outdoor",
      "probs": {
        "home": 0.7913,
        "away": 0.2087
      },
      "model": "elo_prior",
      "estimate": true
    },
    {
      "game_id": "401872959",
      "home": "TB",
      "away": "MIN",
      "kickoff_utc": "2026-09-27T20:05Z",
      "roof": "outdoor",
      "probs": {
        "home": 0.2488,
        "away": 0.7512
      },
      "model": "elo_prior",
      "estimate": true
    },
    {
      "game_id": "401872960",
      "home": "DAL",
      "away": "BAL",
      "kickoff_utc": "2026-09-27T20:25Z",
      "roof": "outdoor",
      "probs": {
        "home": 0.4634,
        "away": 0.5366
      },
      "model": "elo_prior",
      "estimate": true
    },
    {
      "game_id": "401872961",
      "home": "NO",
      "away": "LV",
      "kickoff_utc": "2026-09-27T20:25Z",
      "roof": "indoor",
      "probs": {
        "home": 0.537,
        "away": 0.463
      },
      "model": "elo_prior",
      "estimate": true
    },
    {
      "game_id": "401872962",
      "home": "DEN",
      "away": "LAR",
      "kickoff_utc": "2026-09-28T00:20Z",
      "roof": "outdoor",
      "probs": {
        "home": 0.6032,
        "away": 0.3968
      },
      "model": "elo_prior",
      "estimate": true
    }
  ]
}
