{
  "season": 2026,
  "week": 4,
  "updated_utc": "2026-10-04T22:53:32Z",
  "games": [
    {
      "game_id": "401872974",
      "home": "MIN",
      "away": "MIA",
      "kickoff_utc": "2026-10-04T20:05Z",
      "roof": "indoor",
      "probs": {
        "home": 0.7907,
        "away": 0.2093
      },
      "model": "elo_prior",
      "estimate": true
    },
    {
      "game_id": "401872976",
      "home": "LV",
      "away": "KC",
      "kickoff_utc": "2026-10-04T20:25Z",
      "roof": "indoor",
      "probs": {
        "home": 0.4927,
        "away": 0.5073
      },
      "model": "elo_prior",
      "estimate": true
    },
    {
      "game_id": "401872975",
      "home": "SF",
      "away": "DEN",
      "kickoff_utc": "2026-10-04T20:25Z",
      "roof": "outdoor",
      "probs": {
        "home": 0.6217,
        "away": 0.3783
      },
      "model": "elo_prior",
      "estimate": true
    },
    {
      "game_id": "401872977",
      "home": "SEA",
      "away": "LAC",
      "kickoff_utc": "2026-10-04T20:25Z",
      "roof": "outdoor",
      "probs": {
        "home": 0.7892,
        "away": 0.2108
      },
      "model": "elo_prior",
      "estimate": true
    },
    {
      "game_id": "401872965",
      "home": "WAS",
      "away": "IND",
      "kickoff_utc": "2026-10-04T13:30Z",
      "roof": "outdoor",
      "probs": {
        "home": 0.3428,
        "away": 0.6572
      },
      "model": "elo_prior",
      "estimate": true
    },
    {
      "game_id": "401872971",
      "home": "BUF",
      "away": "NE",
      "kickoff_utc": "2026-10-04T17:00Z",
      "roof": "outdoor",
      "probs": {
        "home": 0.5818,
        "away": 0.4182
      },
      "model": "elo_prior",
      "estimate": true
    },
    {
      "game_id": "401872972",
      "home": "CHI",
      "away": "NYJ",
      "kickoff_utc": "2026-10-04T17:00Z",
      "roof": "outdoor",
      "probs": {
        "home": 0.7004,
        "away": 0.2996
      },
      "model": "elo_prior",
      "estimate": true
    },
    {
      "game_id": "401872969",
      "home": "CIN",
      "away": "JAX",
      "kickoff_utc": "2026-10-04T17:00Z",
      "roof": "outdoor",
      "probs": {
        "home": 0.3877,
        "away": 0.6123
      },
      "model": "elo_prior",
      "estimate": true
    },
    {
      "game_id": "401872966",
      "home": "NYG",
      "away": "ARI",
      "kickoff_utc": "2026-10-04T17:00Z",
      "roof": "outdoor",
      "probs": {
        "home": 0.6606,
        "away": 0.3394
      },
      "model": "elo_prior",
      "estimate": true
    },
    {
      "game_id": "401872970",
      "home": "PHI",
      "away": "LAR",
      "kickoff_utc": "2026-10-04T17:00Z",
      "roof": "outdoor",
      "probs": {
        "home": 0.4638,
        "away": 0.5362
      },
      "model": "elo_prior",
      "estimate": true
    },
    {
      "game_id": "401872968",
      "home": "TB",
      "away": "GB",
      "kickoff_utc": "2026-10-04T17:00Z",
      "roof": "outdoor",
      "probs": {
        "home": 0.3726,
        "away": 0.6274
      },
      "model": "elo_prior",
      "estimate": true
    },
    {
      "game_id": "401872973",
      "home": "BAL",
      "away": "TEN",
      "kickoff_utc": "2026-10-04T17:00Z",
      "roof": "outdoor",
      "probs": {
        "home": 0.7885,
        "away": 0.2115
      },
      "model": "elo_prior",
      "estimate": true
    },
    {
      "game_id": "401872967",
      "home": "HOU",
      "away": "DAL",
      "kickoff_utc": "2026-10-04T17:00Z",
      "roof": "indoor",
      "probs": {
        "home": 0.5773,
        "away": 0.4227
      },
      "model": "elo_prior",
      "estimate": true
    },
    {
      "game_id": "401872978",
      "home": "CAR",
      "away": "DET",
      "kickoff_utc": "2026-10-05T00:20Z",
      "roof": "outdoor",
      "probs": {
        "home": 0.5016,
        "away": 0.4984
      },
      "model": "elo_prior",
      "estimate": true
    },
    {
      "game_id": "401872964",
      "home": "CLE",
      "away": "PIT",
      "kickoff_utc": "2026-10-02T00:15Z",
      "roof": "outdoor",
      "probs": {
        "home": 0.5324,
        "away": 0.4676
      },
      "model": "elo_prior",
      "estimate": true
    },
    {
      "game_id": "401872979",
      "home": "NO",
      "away": "ATL",
      "kickoff_utc": "2026-10-06T00:15Z",
      "roof": "indoor",
      "probs": {
        "home": 0.5552,
        "away": 0.4448
      },
      "model": "elo_prior",
      "estimate": true
    }
  ]
}
