{
  "season": 2026,
  "week": 6,
  "updated_utc": "2026-10-16T14:46:13Z",
  "games": [
    {
      "game_id": "401872995",
      "home": "DEN",
      "away": "SEA",
      "week": 6,
      "kickoff_utc": "2026-10-16T00:15Z",
      "roof": "outdoor",
      "probs": {
        "home": 0.5388,
        "away": 0.4612
      },
      "model": "elo_prior",
      "estimate": true
    },
    {
      "game_id": "401872996",
      "home": "JAX",
      "away": "HOU",
      "week": 6,
      "kickoff_utc": "2026-10-18T13:30Z",
      "roof": "outdoor",
      "probs": {
        "home": 0.7183,
        "away": 0.2817
      },
      "model": "elo_prior",
      "estimate": true
    },
    {
      "game_id": "401872999",
      "home": "ATL",
      "away": "CHI",
      "week": 6,
      "kickoff_utc": "2026-10-18T17:00Z",
      "roof": "indoor",
      "probs": {
        "home": 0.4987,
        "away": 0.5013
      },
      "model": "elo_prior",
      "estimate": true
    },
    {
      "game_id": "401872997",
      "home": "CLE",
      "away": "BAL",
      "week": 6,
      "kickoff_utc": "2026-10-18T17:00Z",
      "roof": "outdoor",
      "probs": {
        "home": 0.4311,
        "away": 0.5689
      },
      "model": "elo_prior",
      "estimate": true
    },
    {
      "game_id": "401873003",
      "home": "IND",
      "away": "TEN",
      "week": 6,
      "kickoff_utc": "2026-10-18T17:00Z",
      "roof": "indoor",
      "probs": {
        "home": 0.7436,
        "away": 0.2564
      },
      "model": "elo_prior",
      "estimate": true
    },
    {
      "game_id": "401873001",
      "home": "NE",
      "away": "NYJ",
      "week": 6,
      "kickoff_utc": "2026-10-18T17:00Z",
      "roof": "outdoor",
      "probs": {
        "home": 0.7875,
        "away": 0.2125
      },
      "model": "elo_prior",
      "estimate": true
    },
    {
      "game_id": "401873000",
      "home": "NYG",
      "away": "NO",
      "week": 6,
      "kickoff_utc": "2026-10-18T17:00Z",
      "roof": "outdoor",
      "probs": {
        "home": 0.6511,
        "away": 0.3489
      },
      "model": "elo_prior",
      "estimate": true
    },
    {
      "game_id": "401872998",
      "home": "PHI",
      "away": "CAR",
      "week": 6,
      "kickoff_utc": "2026-10-18T17:00Z",
      "roof": "outdoor",
      "probs": {
        "home": 0.4532,
        "away": 0.5468
      },
      "model": "elo_prior",
      "estimate": true
    },
    {
      "game_id": "401873002",
      "home": "TB",
      "away": "PIT",
      "week": 6,
      "kickoff_utc": "2026-10-18T17:00Z",
      "roof": "outdoor",
      "probs": {
        "home": 0.3359,
        "away": 0.6641
      },
      "model": "elo_prior",
      "estimate": true
    },
    {
      "game_id": "401873004",
      "home": "LAR",
      "away": "ARI",
      "week": 6,
      "kickoff_utc": "2026-10-18T20:05Z",
      "roof": "outdoor",
      "probs": {
        "home": 0.7717,
        "away": 0.2283
      },
      "model": "elo_prior",
      "estimate": true
    },
    {
      "game_id": "401873006",
      "home": "KC",
      "away": "LAC",
      "week": 6,
      "kickoff_utc": "2026-10-18T20:25Z",
      "roof": "outdoor",
      "probs": {
        "home": 0.7342,
        "away": 0.2658
      },
      "model": "elo_prior",
      "estimate": true
    },
    {
      "game_id": "401873005",
      "home": "LV",
      "away": "BUF",
      "week": 6,
      "kickoff_utc": "2026-10-18T20:25Z",
      "roof": "indoor",
      "probs": {
        "home": 0.3523,
        "away": 0.6477
      },
      "model": "elo_prior",
      "estimate": true
    },
    {
      "game_id": "401873007",
      "home": "GB",
      "away": "DAL",
      "week": 6,
      "kickoff_utc": "2026-10-19T00:20Z",
      "roof": "outdoor",
      "probs": {
        "home": 0.6471,
        "away": 0.3529
      },
      "model": "elo_prior",
      "estimate": true
    },
    {
      "game_id": "401873008",
      "home": "SF",
      "away": "WAS",
      "week": 6,
      "kickoff_utc": "2026-10-20T00:15Z",
      "roof": "outdoor",
      "probs": {
        "home": 0.8407,
        "away": 0.1593
      },
      "model": "elo_prior",
      "estimate": true
    }
  ]
}
